{"$schema":"../schemas/capability-pack.schema.json","schemaVersion":"1.0.0","packId":"occasio","version":"1.0.0","status":"characterization","base":false,"defaultActivation":false,"tools":[{"id":"wo_file_finding","schemaRef":"schema:wo-file-finding"}],"implementationDigest":null,"declaredEffects":["filesystem-write","durable-write","network-write","credential-use"],"requiredRuntimeApi":"trio-runtime >=0.1 <1.0","externalDependencies":[{"id":"work-orders","optional":false},{"id":"routing-port","optional":false}],"configurationSchemaRef":null,"authorityRequirements":["capsule-request","deployment-pack-enable","injected-persistence","injected-routing","credential-handles","network-write-capability"],"evidenceRequirements":["finding, persistence and each route outcome separately bound"],"receiptRequirements":["partial/degraded result cannot be reported as complete"],"availabilityStates":["inactive","available","degraded","unavailable"]}
