{"$schema":"../schemas/capability-pack.schema.json","schemaVersion":"1.0.0","packId":"model-reports","version":"0.1.0","status":"planned","base":false,"defaultActivation":false,"tools":[],"implementationDigest":null,"declaredEffects":["read","durable-write"],"requiredRuntimeApi":"unresolved","externalDependencies":[],"configurationSchemaRef":null,"authorityRequirements":["authenticated-caller","capsule-request","deployment-pack-enable"],"evidenceRequirements":["task/model/run attribution"],"receiptRequirements":["version-bound report receipt"],"availabilityStates":["inactive","unavailable"]}
