{"$schema":"../schemas/capability-pack.schema.json","schemaVersion":"1.0.0","packId":"onboarding","version":"0.1.0","status":"planned","base":false,"defaultActivation":false,"tools":[],"implementationDigest":null,"declaredEffects":["read"],"requiredRuntimeApi":"unresolved","externalDependencies":[],"configurationSchemaRef":null,"authorityRequirements":["capsule-request","deployment-pack-enable"],"evidenceRequirements":["source-attributed health and capability data"],"receiptRequirements":["none until API is designed"],"availabilityStates":["inactive","unavailable"]}
