{"$schema":"../schemas/capability-pack.schema.json","schemaVersion":"1.0.0","packId":"work-orders","version":"1.0.0","status":"characterization","base":false,"defaultActivation":false,"tools":[{"id":"wo_list","schemaRef":"schema:wo-list"},{"id":"wo_get","schemaRef":"schema:wo-get"},{"id":"wo_transition","schemaRef":"schema:wo-transition"}],"implementationDigest":null,"declaredEffects":["read","filesystem-write","durable-write"],"requiredRuntimeApi":"trio-runtime >=0.1 <1.0","externalDependencies":[],"configurationSchemaRef":null,"authorityRequirements":["capsule-request","deployment-pack-enable","durable-write-capability for wo_transition"],"evidenceRequirements":["store result bound to task and work-order ID"],"receiptRequirements":["transition before/after state and store identity"],"availabilityStates":["inactive","available","degraded","unavailable"]}
